{
  "$schema": "https://json-schema.org/draft/2020-12/schema",
  "additionalProperties": false,
  "properties": {
    "files": {
      "items": {
        "additionalProperties": false,
        "properties": {
          "path": {
            "minLength": 1,
            "type": "string"
          },
          "sha256": {
            "pattern": "^[a-f0-9]{64}$",
            "type": "string"
          }
        },
        "required": [
          "path",
          "sha256"
        ],
        "type": "object"
      },
      "minItems": 1,
      "type": "array"
    },
    "git_commit": {
      "minLength": 7,
      "type": "string"
    },
    "invalidates_on": {
      "items": {
        "minLength": 1,
        "type": "string"
      },
      "minItems": 1,
      "type": "array"
    },
    "lock_id": {
      "minLength": 1,
      "type": "string"
    },
    "phase": {
      "minLength": 1,
      "type": "string"
    },
    "root_sha256": {
      "pattern": "^[a-f0-9]{64}$",
      "type": "string"
    },
    "spec_lock_hash": {
      "pattern": "^[a-f0-9]{64}$",
      "type": "string"
    },
    "test_results": {
      "items": {
        "additionalProperties": false,
        "properties": {
          "command": {
            "minLength": 1,
            "type": "string"
          },
          "exit_code": {
            "type": "integer"
          },
          "result_hash": {
            "pattern": "^[a-f0-9]{64}$",
            "type": "string"
          }
        },
        "required": [
          "command",
          "exit_code",
          "result_hash"
        ],
        "type": "object"
      },
      "minItems": 1,
      "type": "array"
    },
    "validator_identity_hashes": {
      "items": {
        "pattern": "^[a-f0-9]{64}$",
        "type": "string"
      },
      "minItems": 1,
      "type": "array"
    }
  },
  "required": [
    "lock_id",
    "phase",
    "git_commit",
    "spec_lock_hash",
    "files",
    "test_results",
    "validator_identity_hashes",
    "root_sha256",
    "invalidates_on"
  ],
  "type": "object"
}
